EVENT_ID,CZ_NAME_STR,BEGIN_LOCATION,BEGIN_DATE,BEGIN_TIME,EVENT_TYPE,MAGNITUDE,TOR_F_SCALE,DEATHS_DIRECT,INJURIES_DIRECT,DAMAGE_PROPERTY_NUM,DAMAGE_CROPS_NUM,STATE_ABBR,CZ_TIMEZONE,MAGNITUDE_TYPE,EPISODE_ID,CZ_TYPE,CZ_FIPS,WFO,INJURIES_INDIRECT,DEATHS_INDIRECT,SOURCE,FLOOD_CAUSE,TOR_LENGTH,TOR_WIDTH,BEGIN_RANGE,BEGIN_AZIMUTH,END_RANGE,END_AZIMUTH,END_LOCATION,END_DATE,END_TIME,BEGIN_LAT,BEGIN_LON,END_LAT,END_LON,EVENT_NARRATIVE,EPISODE_NARRATIVE,ABSOLUTE_ROWNUMBER
422500,UNION CO.,WAVERLY,01/12/2013,1602,Funnel Cloud, , ,0,0,0,0,KY,CST-6, ,70343,C,225,PAH,0,0,Public, , , ,0,S,0,S,WAVERLY,01/12/2013,1602,37.72,-87.82,37.72,-87.82,"","During the afternoon, a supercell thunderstorm developed along a quasi-stationary front that extended from southwest to northeast along the Lower Ohio River Valley. Deep and strong southwesterly wind flow stretched from Texas to the Great Lakes region ahead of an expansive upper-level trough over the western and central states. Several weak disturbances tracked northeastward, contributing to the development of the isolated supercell. Strong low and mid-level wind fields supported the formation of the supercell, which spawned an isolated EF-2 tornado in Livingston County.|Later on during the night, more storms developed in a region of strong warm advection near a low level jet in excess of 50 knots. Marginal instability developed as a surface warm front lifted northward. This round of storms produced heavy rain and some flash flooding.",97
424825,CALLOWAY CO.,LYNN GROVE,01/29/2013,2336,Tornado, ,EF0,0,0,25000,0,KY,CST-6, ,70738,C,35,PAH,0,0,NWS Storm Survey, ,2.12,100,1,SSE,1,NNW,WISWELL,01/29/2013,2339,36.5927,-88.4261,36.5998,-88.389,"Several outbuildings were damaged or destroyed. A dog kennel was picked up and destroyed. Several shallow-rooted trees were uprooted, and one tree was snapped. A carport was destroyed. There was minor roof damage to some homes, mostly shingles blown off. Porch columns on a home were shifted. There was light damage to a total of nine homes along State Route 94. Two car windows were broken by falling tree limbs. A power pole was snapped at the intersection of Highways 94 and 783. The average path width was 50 yards. Peak winds were estimated near 80 mph.","A line of thunderstorms intensified as it moved east from Missouri. The storms increased as they moved into slightly more unstable air associated with a strengthening low level jet. The storms were aided by the approach of a strong upper level trough. Despite weak instability, winds of 90 knots in the lowest 3 kilometers coupled with extreme shear values resulted in damaging winds and isolated tornadoes with the strongest storms. Ahead of the thunderstorms, strong southerly gradient winds gusted up to 45 mph, mainly along and southeast of a line from Owensboro to Murray.",98
424828,CHRISTIAN CO.,GARRETSBURG,01/30/2013,136,Tornado, ,EF2,0,0,150000,0,KY,CST-6, ,70738,C,47,PAH,0,0,NWS Storm Survey, ,2.06,200,2,WNW,3,SE,HERNDON,01/30/2013,138,36.68,-87.56,36.6993,-87.5317,"The peak winds in the tornado were estimated near 120 mph. The average damage path width was about 150 yards. Three homes sustained major damage. A two-story Amish home had its entire roof system removed, and a window was blown out. A block wall milk barn was levelled except for part of the north wall. A machine shop was unroofed, and a barn was levelled. Numerous trees were snapped or uprooted. Trained spotters observed light debris in the air near Herndon.","A line of thunderstorms intensified as it moved east from Missouri. The storms increased as they moved into slightly more unstable air associated with a strengthening low level jet. The storms were aided by the approach of a strong upper level trough. Despite weak instability, winds of 90 knots in the lowest 3 kilometers coupled with extreme shear values resulted in damaging winds and isolated tornadoes with the strongest storms. Ahead of the thunderstorms, strong southerly gradient winds gusted up to 45 mph, mainly along and southeast of a line from Owensboro to Murray.",99
424830,CHRISTIAN CO.,HOPKINSVILLE,01/30/2013,139,Tornado, ,EF1,0,0,250000,0,KY,CST-6, ,70738,C,47,PAH,0,0,NWS Storm Survey, ,7.92,225,8,S,1,NNW,PEMBROKE,01/30/2013,146,36.7342,-87.48,36.7961,-87.3595,"The tornado touched down along U.S. Highway 41A and travelled northeast to U.S. Highway 41. Hundreds of trees were snapped or uprooted. One grain bin was blown 150 feet. Several barns or sheds were levelled. At least two dozen power poles were broken along Highway 1027 and U.S. Highway 41. Several homes received mainly minor roof damage. The tornado had estimated peak winds of 105 mph. The average path width was 175 yards.","A line of thunderstorms intensified as it moved east from Missouri. The storms increased as they moved into slightly more unstable air associated with a strengthening low level jet. The storms were aided by the approach of a strong upper level trough. Despite weak instability, winds of 90 knots in the lowest 3 kilometers coupled with extreme shear values resulted in damaging winds and isolated tornadoes with the strongest storms. Ahead of the thunderstorms, strong southerly gradient winds gusted up to 45 mph, mainly along and southeast of a line from Owensboro to Murray.",100
424832,MUHLENBERG CO.,ROSEWOOD,01/30/2013,200,Tornado, ,EF2,0,0,250000,0,KY,CST-6, ,70738,C,177,PAH,0,0,NWS Storm Survey, ,5.14,325,2,SE,0,SE,PENROD,01/30/2013,206,37.0595,-87.0544,37.12,-87,"Peak winds were estimated near 120 mph. The average path width was 275 yards. Large portions of the roof structure were removed from one home, including rafters. Several other homes lost varying numbers of shingles. Siding was damaged on several homes, along with a few destroyed porches. Two mobile homes were completely destroyed, including one mobile home that was overturned. Hundreds of trees were snapped or uprooted. Power outages were reported.","A line of thunderstorms intensified as it moved east from Missouri. The storms increased as they moved into slightly more unstable air associated with a strengthening low level jet. The storms were aided by the approach of a strong upper level trough. Despite weak instability, winds of 90 knots in the lowest 3 kilometers coupled with extreme shear values resulted in damaging winds and isolated tornadoes with the strongest storms. Ahead of the thunderstorms, strong southerly gradient winds gusted up to 45 mph, mainly along and southeast of a line from Owensboro to Murray.",101
421959,WARREN CO.,OAKLAND,01/30/2013,338,Tornado, ,EF2,0,0,400000,0,KY,CST-6, ,70270,C,227,LMK,0,0,NWS Storm Survey, ,2.96,250,1,ESE,2,E,SMITHS GROVE,01/30/2013,341,37.0272,-86.241,37.0464,-86.193,"An EF-2 tornado touched down just to the east of Interstate 65 around 3 miles southwest of Smith's Grove.  After damaging several outbuildings, it encountered a set of 4 grain silos just to the south of Glasgow Road. It destroyed all 4 silos and threw their remains several hundred yards to the east. The tornado stayed on the ground  for  3 miles, eventually crossing Interstate 65 just south of Smith's Grove. This tornado overturned a semi-trailer on the interstate. Before lifting up just to the east of Smith's Grove, it destroyed an older wooden barn and a large  well constructed dairy barn, ripping steel I-beams out of their concrete base, scattering its roof, and collapsing its southern and eastern cinder block walls.","During the evening hours on the 29th of January, low pressure across the southern plains began to intensify and move towards the western Great Lakes. A squall line developed during the evening hours and strengthened after midnight as it moved into western Kentucky and southern Illinois. This line, fueled by unseasonably mild temperatures near 70 degrees, dewpoints around 60, and an intense low level jet of 80kt at 850mb, spawned one of the largest January tornadic outbreaks on record across the Lower Ohio Valley. This line entered west central Kentucky around 2 am January 30th, exiting the Bluegrass and Lake Cumberland Regions during the pre-dawn hours. Several circulations along the squall line produced tornadoes. In addition, strong synoptic southerly winds right ahead and along this line produced localized wind damage.",102
422000,EDMONSON CO.,ROCKY HILL,01/30/2013,342,Tornado, ,EF1,0,0,80000,0,KY,CST-6, ,70270,C,61,LMK,0,0,NWS Storm Survey, ,2.77,100,0,WSW,2,NE,ROCKY HILL,01/30/2013,344,37.0671,-86.1368,37.0941,-86.0996,"A circulation embedded within a squall line that earlier produced an EF-2 tornado in Warren County spawned a second tornado that briefly touched down in Rocky Hill. It then lifted and touched down again around one mile to the northeast. Along its second track, which was around seven tenths of a mile, it snapped several trees within two  long rows of trees along fence lines. Near the end of its path, along Louisville Road, it tore half the roof off of a home and destroyed a nearby barn.","During the evening hours on the 29th of January, low pressure across the southern plains began to intensify and move towards the western Great Lakes. A squall line developed during the evening hours and strengthened after midnight as it moved into western Kentucky and southern Illinois. This line, fueled by unseasonably mild temperatures near 70 degrees, dewpoints around 60, and an intense low level jet of 80kt at 850mb, spawned one of the largest January tornadic outbreaks on record across the Lower Ohio Valley. This line entered west central Kentucky around 2 am January 30th, exiting the Bluegrass and Lake Cumberland Regions during the pre-dawn hours. Several circulations along the squall line produced tornadoes. In addition, strong synoptic southerly winds right ahead and along this line produced localized wind damage.",103
422025,BARREN CO.,ROCKY HILL,01/30/2013,349,Tornado, ,EF1,0,0,0,0,KY,CST-6, ,70270,C,9,LMK,0,0,NWS Storm Survey, ,0.34,50,1,NE,1,NE,ROCKY HILL,01/30/2013,350,36.9433,-86.057,36.9462,-86.0525,"A short-lived EF-1 tornado destroyed a well built barn and knocked down several trees along Finney Road, located a mile east of the small town of Rocky Hill.","During the evening hours on the 29th of January, low pressure across the southern plains began to intensify and move towards the western Great Lakes. A squall line developed during the evening hours and strengthened after midnight as it moved into western Kentucky and southern Illinois. This line, fueled by unseasonably mild temperatures near 70 degrees, dewpoints around 60, and an intense low level jet of 80kt at 850mb, spawned one of the largest January tornadic outbreaks on record across the Lower Ohio Valley. This line entered west central Kentucky around 2 am January 30th, exiting the Bluegrass and Lake Cumberland Regions during the pre-dawn hours. Several circulations along the squall line produced tornadoes. In addition, strong synoptic southerly winds right ahead and along this line produced localized wind damage.",104
421962,MEADE CO.,BUCK GROVE,01/30/2013,405,Tornado, ,EF0,0,0,50000,0,KY,EST-5, ,70270,C,163,LMK,0,0,NWS Storm Survey, ,1,200,2,NE,2,SSE,BRANDENBURG STATION,01/30/2013,406,37.9377,-86.1042,37.9452,-86.0877,"A storm survey revealed that an EF-0 tornado with estimated 80 mph winds and a width of 200 yards struck Meade County around 5.7 miles southeast of Brandenburg. Initially, this tornado touched down in a grove of trees near the end of Kurtz Drive. It then damaged several homes on Kurtz Drive and near the intersection of Thornhill Drive and Gaines Road.  One owner of a home east of Gaines Road mentioned that water was evacuated from all 4 toilets as the tornado passed by. Local residents reported a loud roar.  Another home along Gaines Road has its front door pulled off.  Before lifting right off Tom Cain Road, the tornado damaged a small shed.","During the evening hours on the 29th of January, low pressure across the southern plains began to intensify and move towards the western Great Lakes. A squall line developed during the evening hours and strengthened after midnight as it moved into western Kentucky and southern Illinois. This line, fueled by unseasonably mild temperatures near 70 degrees, dewpoints around 60, and an intense low level jet of 80kt at 850mb, spawned one of the largest January tornadic outbreaks on record across the Lower Ohio Valley. This line entered west central Kentucky around 2 am January 30th, exiting the Bluegrass and Lake Cumberland Regions during the pre-dawn hours. Several circulations along the squall line produced tornadoes. In addition, strong synoptic southerly winds right ahead and along this line produced localized wind damage.",105
421955,JEFFERSON CO.,VALLEY VLG,01/30/2013,418,Tornado, ,EF0,0,0,75000,0,KY,EST-5, ,70270,C,111,LMK,0,0,NWS Storm Survey, ,2.23,215,2,N,0,SSW,SYLVANIA,01/30/2013,419,38.1247,-85.9052,38.1438,-85.8722,"An EF-0 tornado that started in Harrison County, Indiana and crossed the Ohio River ended in the Pleasure Ridge Park area of southwest Louisville.  The total path length in Kentucky was 2.25 miles. Overall, the entire path length of this tornado, including the portion in Indiana, was 2.8 miles.  While in Kentucky, this twister did roof and siding damage to many homes in the Greenridge Estates subdivision in addition to uprooting several trees.","During the evening hours on the 29th of January, low pressure across the southern plains began to intensify and move towards the western Great Lakes. A squall line developed during the evening hours and strengthened after midnight as it moved into western Kentucky and southern Illinois. This line, fueled by unseasonably mild temperatures near 70 degrees, dewpoints around 60, and an intense low level jet of 80kt at 850mb, spawned one of the largest January tornadic outbreaks on record across the Lower Ohio Valley. This line entered west central Kentucky around 2 am January 30th, exiting the Bluegrass and Lake Cumberland Regions during the pre-dawn hours. Several circulations along the squall line produced tornadoes. In addition, strong synoptic southerly winds right ahead and along this line produced localized wind damage.",106
421958,MARION CO.,PHILLIPSBURG,01/30/2013,544,Tornado, ,EF0,0,2,25000,0,KY,EST-5, ,70270,C,155,LMK,0,0,NWS Storm Survey, ,0.12,50,1,S,1,SSE,PHILLIPSBURG,01/30/2013,545,37.4393,-85.269,37.4404,-85.2671,"A weak EF-0 tornado with estimated winds of 80 to 85 mph briefly touched down along Calvary Road around 7 miles southwest of Bradfordsville. Although this twister had a path length estimated of only a tenth of a mile, it did destroy a mobile home, injuring two occupants. It also slid a shed off of its foundation.","During the evening hours on the 29th of January, low pressure across the southern plains began to intensify and move towards the western Great Lakes. A squall line developed during the evening hours and strengthened after midnight as it moved into western Kentucky and southern Illinois. This line, fueled by unseasonably mild temperatures near 70 degrees, dewpoints around 60, and an intense low level jet of 80kt at 850mb, spawned one of the largest January tornadic outbreaks on record across the Lower Ohio Valley. This line entered west central Kentucky around 2 am January 30th, exiting the Bluegrass and Lake Cumberland Regions during the pre-dawn hours. Several circulations along the squall line produced tornadoes. In addition, strong synoptic southerly winds right ahead and along this line produced localized wind damage.",107
430757,PULASKI CO.,FERGUSON,01/30/2013,630,Tornado, ,EF0,0,0,5000,0,KY,EST-5, ,71594,C,199,JKL,0,0,NWS Storm Survey, ,0.5,150,1,SSW,0,S,FERGUSON,01/30/2013,631,37.0598,-84.6052,37.0657,-84.5992,"A storm damage survey team from the National Weather Service office in Jackson, KY confirmed an EF-0 tornado in Pulaski County around 630 am EST this morning, January 30th. Touchdown occurred in the Ferguson Community near the end of the runway of the Lake Cumberland Regional Airport. The tornado traveled a half mile through a residential area crossing Murphy Avenue near the Gover Lane intersection. Some roof and siding damage was noted to structures along the path. Several trees were also downed along the path and one tree fell across and destroyed a shed.  This is the first documented tornado to occur during the month of January in the National Weather Service Jackson, KY forecast area.","A strong cold front moveds across eastern Kentucky during the morning hours. In advance of this front, a line of severe thunderstorms raced across the area producing numerous reports of wind damage and an isolated tornado in Pulaski County. Moderate to heavy rainfall lingered over far southeast Kentucky, causing some minor flooding later into the day and through the night for parts of Floyd, Letcher, and Harlan Counties.",108
432157,PULASKI CO.,FERGUSON,03/24/2013,1640,Tornado, ,EF1,0,0,100000,0,KY,EST-5, ,71757,C,199,JKL,0,0,NWS Storm Survey, ,0.36,80,0,S,0,ESE,FERGUSON,03/24/2013,1641,37.0651,-84.5999,37.0679,-84.5944,"A storm damage survey team consisting of officials from the National Weather Service in Jackson, KY and the Ferguson Fire Department confirmed damage from an EF-1 tornado in the Ferguson community.  Touchdown occurred at a warehouse building on Waddle Street.  The tornado traveled approximately 700 yards, destroying the warehouse, damaging the roofs of several homes and downing multiple trees along it's path.  The warehouse building destroyed in this tornado received roof damage from the January 30th tornado as the two tornado tracks overlapped for a short distance.","A few instances of wind damage and an isolated tornado was spawned in advance of a low pressure system tracking across central and eastern Kentucky during the early evening hours of Sunday March 24th.",109
439361,MONTGOMERY CO.,CAMARGO,04/11/2013,1800,Funnel Cloud, , ,0,0,0,0,KY,EST-5, ,72805,C,173,JKL,0,0,911 Call Center, , , ,0,N,0,N,CAMARGO,04/11/2013,1800,38,-83.88,38,-83.88,"A funnel cloud was reported from 4755 Camargo-Levee Road in the Camargo area.","A potent cold front, ample low level moisture, and abundant instability combined to bring severe weather to portions of eastern Kentucky during the evening hours of April 11th. The bulk of the severe weather occurred in Bath and Montgomery counties, with isolated severe events also occurring in Rockcastle, Laurel, Rowan, and Whitley counties. Significant wind damage occurred in Montgomery county between Camargo and Jeffersonville.",110
439363,MONTGOMERY CO.,JEFFERSONVILLE,04/11/2013,1800,Funnel Cloud, , ,0,0,0,0,KY,EST-5, ,72805,C,173,JKL,0,0,911 Call Center, , , ,0,N,0,N,JEFFERSONVILLE,04/11/2013,1800,37.98,-83.85,37.98,-83.85,"A funnel cloud was sighted from 8745 Main Street in Jeffersonville.","A potent cold front, ample low level moisture, and abundant instability combined to bring severe weather to portions of eastern Kentucky during the evening hours of April 11th. The bulk of the severe weather occurred in Bath and Montgomery counties, with isolated severe events also occurring in Rockcastle, Laurel, Rowan, and Whitley counties. Significant wind damage occurred in Montgomery county between Camargo and Jeffersonville.",111
439511,GRAVES CO.,WATER VLY,04/18/2013,1924,Tornado, ,EF0,0,0,10000,0,KY,CST-6, ,72844,C,83,PAH,0,0,NWS Storm Survey, ,0.33,100,4,ESE,1,W,PILOT OAK,04/18/2013,1925,36.5479,-88.7334,36.551,-88.7289,"The weak tornado briefly touched down, removing a few shingles from two homes.  One home had soffit damage. A couple large branches were blown down. Peak winds were estimated near 75 mph. The average path width was about 100 yards.","Small, low-topped thunderstorm line segments moved northeast in a region of strong vertical wind shear and very weak instability. These line segments produced a few short-track, weak tornadoes and isolated wind damage. The tornadoes formed from mesovortices embedded within the line. There was little if any lightning associated with the convection. The storms occurred along a cold front that extended southward from a low pressure center in northern Illinois.",112
439512,GRAVES CO.,SEDALIA,04/18/2013,1931,Tornado, ,EF0,0,0,3000,0,KY,CST-6, ,72844,C,83,PAH,0,0,NWS Storm Survey, ,3.17,100,4,SW,2,W,SEDALIA,04/18/2013,1935,36.6065,-88.6542,36.65,-88.6361,"Several large branches were blown down. The average damage path width was 100 yards and the peak winds were 75 mph.","Small, low-topped thunderstorm line segments moved northeast in a region of strong vertical wind shear and very weak instability. These line segments produced a few short-track, weak tornadoes and isolated wind damage. The tornadoes formed from mesovortices embedded within the line. There was little if any lightning associated with the convection. The storms occurred along a cold front that extended southward from a low pressure center in northern Illinois.",113
439513,GRAVES CO.,SYMSONIA,04/18/2013,1954,Tornado, ,EF0,0,0,35000,0,KY,CST-6, ,72844,C,83,PAH,0,0,NWS Storm Survey, ,2.21,150,4,S,3,E,KALER,04/18/2013,1957,36.8578,-88.52,36.8733,-88.4851,"There was shingle and soffit damage to several homes. Several trees were snapped, and large branches were blown down. The average damage path width was 150 yards, and the peak winds were about 80 mph. The tornado moved into Marshall County near the community of Oak Level.","Small, low-topped thunderstorm line segments moved northeast in a region of strong vertical wind shear and very weak instability. These line segments produced a few short-track, weak tornadoes and isolated wind damage. The tornadoes formed from mesovortices embedded within the line. There was little if any lightning associated with the convection. The storms occurred along a cold front that extended southward from a low pressure center in northern Illinois.",114
439514,MARSHALL CO.,OAK LEVEL,04/18/2013,1957,Tornado, ,EF0,0,0,8000,0,KY,CST-6, ,72844,C,157,PAH,0,0,NWS Storm Survey, ,1.39,150,1,WNW,1,NNE,OAK LEVEL,04/18/2013,1959,36.8733,-88.4851,36.8834,-88.4633,"The tornado continued from Graves County into Marshall County. There was shingle and soffit damage to a few homes. Several trees were snapped, and large branches were blown down. The average damage path width was 150 yards, and the peak winds were about 80 mph.","Small, low-topped thunderstorm line segments moved northeast in a region of strong vertical wind shear and very weak instability. These line segments produced a few short-track, weak tornadoes and isolated wind damage. The tornadoes formed from mesovortices embedded within the line. There was little if any lightning associated with the convection. The storms occurred along a cold front that extended southward from a low pressure center in northern Illinois.",115
450030,DAVIESS CO.,MASONVILLE,05/30/2013,1725,Funnel Cloud, , ,0,0,0,0,KY,CST-6, ,74244,C,59,PAH,0,0,Emergency Manager, , , ,2,W,2,W,MASONVILLE,05/30/2013,1725,37.67,-87.0666,37.67,-87.0666,"A funnel cloud was identified and photographed by a trained spotter.","Clusters of thunderstorms moved north across western Kentucky. The storms occurred in a southwesterly flow of moist and moderately unstable air. The storms were enhanced by a 500 mb shortwave extending from the Ozarks to the Lower Mississippi Valley. A few of the storms produced large hail and strong winds.",116
458060,JOHNSON CO.,LOWMANSVILLE,06/09/2013,1654,Tornado, ,EF0,0,0,0,0,KY,EST-5, ,75790,C,115,JKL,0,0,NWS Storm Survey, ,0.1,50,1,SE,1,SE,LOWMANSVILLE,06/09/2013,1655,37.908,-82.7198,37.9081,-82.7181,"The National Weather Service in Charleston, WV confirmed tree damage near the Johnson/Lawrence County line was caused by an EF0 tornado. The tornado tracked about 115 yards in Johnson County, KY before passing into Lawrence County (NWS Charleston, WV County Warning Area).","A large slow moving area of low pressure located over the northern plains and a large subtropical ridge of high pressure situated off the southeastern U.S. produced a steady flow of warm moist air off the Gulf of Mexico and convergence over central and eastern Kentucky on June 9th. As a result, scattered strong to severe thunderstorms formed and moved from south to north across eastern Kentucky during the afternoon and evening.  One storm in particular produced sporadic wind damage and large hail in a track from near Beattyville in Lee County, then across Wolfe, Magoffin and Johnson Counties.  Significant straight-line wind damage occurred from this storm in the Wheelersburg community of Magoffin County.  The storm then went on to produce a short-lived tornado on the Johnson/Lawrence County line.",117
