EVENT_ID,CZ_NAME_STR,BEGIN_LOCATION,BEGIN_DATE,BEGIN_TIME,EVENT_TYPE,MAGNITUDE,TOR_F_SCALE,DEATHS_DIRECT,INJURIES_DIRECT,DAMAGE_PROPERTY_NUM,DAMAGE_CROPS_NUM,STATE_ABBR,CZ_TIMEZONE,MAGNITUDE_TYPE,EPISODE_ID,CZ_TYPE,CZ_FIPS,WFO,INJURIES_INDIRECT,DEATHS_INDIRECT,SOURCE,FLOOD_CAUSE,TOR_LENGTH,TOR_WIDTH,BEGIN_RANGE,BEGIN_AZIMUTH,END_RANGE,END_AZIMUTH,END_LOCATION,END_DATE,END_TIME,BEGIN_LAT,BEGIN_LON,END_LAT,END_LON,EVENT_NARRATIVE,EPISODE_NARRATIVE,ABSOLUTE_ROWNUMBER
299407,BOYD CO.,CANNONSBURG,05/10/2011,1830,Funnel Cloud, , ,0,0,0,0,KY,EST-5, ,50741,C,19,RLX,0,0,Emergency Manager, , , ,0,N,0,N,CANNONSBURG,05/10/2011,1830,38.38,-82.7,38.38,-82.7,"","Repetitive showers and thunderstorms, moved southeast through southeast Ohio and into portions of northeast Kentucky between 1500E and 1830E on Tuesday, the 10th.  In northeast Kentucky, the heaviest rains fell in eastern Greenup County and Boyd County.  Later that night some minor water problems reached south, into Lawrence County. ||This convection was just northeast of a warm front.  A sharp dew point gradient existed across the front.  Surface dew points were around 70 degrees just southwest of the boundary.  Luckily, later that same night, repetitive convection occurred in the Scioto River Valley of southern Ohio, missing this area just to the northwest.   ||Initially, the main impact was large hail.  As back building caused repetitive showers and thunderstorms, flooding became the primary issue.  Maximum rain amounts of 3 to 4 inches were observed.   The urban areas around Ashland likely had the heaviest rain. The highest total was 4 inches, measured at the Ashland cooperative observer site.",1
301297,CHRISTIAN CO.,LA FAYETTE,05/23/2011,1810,Tornado, ,EF2,0,1,350000,0,KY,CST-6, ,50953,C,47,PAH,0,0,NWS Storm Survey, ,17.3,175,3,SE,3,NW,PEMBROKE,05/23/2011,1827,36.6383,-87.6149,36.8107,-87.3883,"This tornado crossed into Kentucky from Stewart County, Tennessee. Several barns and grain bins were damaged or destroyed. A dairy barn with 45 cows inside was destroyed. Although all the cows were trapped under the collapsed barn, only two of the cows were injured. One of the cows was thrown 500 feet from its stall. Numerous large trees were snapped or uprooted. A tractor-trailer rig hauling freight was overturned at mile-marker 85 on Interstate 24. The driver suffered minor injuries and was taken to a regional hospital. The roof was torn from an agricultural chemical storage building. A tool barn was destroyed. At a farm near Pembroke, a large tree fell on a house, a large barn was flattened, and two large grain bins were destroyed. Peak winds were estimated near 120 mph, but the majority of the damage path was EF-1. The average path width was 150 yards.","A large cluster of thunderstorms increased in coverage and intensity as it accelerated eastward into a rapidly destabilizing air mass. The activity was closely related to a mid-level shortwave trough moving across Iowa and Missouri, along with a low level wind maximum. The storms were associated with isolated large hail, damaging winds, and a tornado.",2
301803,CARLISLE CO.,MILBURN,05/25/2011,1801,Funnel Cloud, , ,0,0,0,0,KY,CST-6, ,51005,C,39,PAH,0,0,Trained Spotter, , , ,0,W,0,W,MILBURN,05/25/2011,1801,36.8,-88.88,36.8,-88.88,"","Numerous strong to severe thunderstorms occurred in the warm sector of a low pressure system over central Missouri. The air mass in the warm sector was very unstable, with afternoon mixed-layer cape values in the 2500 to 4000 j/kg range. A 65 to 75 knot mid level jet was located across Arkansas, with the nose of the jet moving into western Kentucky. This feature enhanced the lift and strong deep-layer shear already in place, creating an environment very favorable for supercells and tornadoes. A 40 to 55 knot low level jet across eastern Arkansas moved into western Kentucky during the evening, resulting in isolated tornadoes and widespread damaging winds.",3
301804,MCCRACKEN CO.,REIDLAND,05/25/2011,1828,Funnel Cloud, , ,0,0,0,0,KY,CST-6, ,51005,C,145,PAH,0,0,Trained Spotter, , , ,0,SE,0,SE,REIDLAND,05/25/2011,1828,37.02,-88.53,37.02,-88.53,"Funnel clouds were reported in the Reidland area.","Numerous strong to severe thunderstorms occurred in the warm sector of a low pressure system over central Missouri. The air mass in the warm sector was very unstable, with afternoon mixed-layer cape values in the 2500 to 4000 j/kg range. A 65 to 75 knot mid level jet was located across Arkansas, with the nose of the jet moving into western Kentucky. This feature enhanced the lift and strong deep-layer shear already in place, creating an environment very favorable for supercells and tornadoes. A 40 to 55 knot low level jet across eastern Arkansas moved into western Kentucky during the evening, resulting in isolated tornadoes and widespread damaging winds.",4
301805,GRAVES CO.,WINGO,05/25/2011,1908,Funnel Cloud, , ,0,0,0,0,KY,CST-6, ,51005,C,83,PAH,0,0,Trained Spotter, , , ,0,SW,0,SW,WINGO,05/25/2011,1908,36.65,-88.73,36.65,-88.73,"","Numerous strong to severe thunderstorms occurred in the warm sector of a low pressure system over central Missouri. The air mass in the warm sector was very unstable, with afternoon mixed-layer cape values in the 2500 to 4000 j/kg range. A 65 to 75 knot mid level jet was located across Arkansas, with the nose of the jet moving into western Kentucky. This feature enhanced the lift and strong deep-layer shear already in place, creating an environment very favorable for supercells and tornadoes. A 40 to 55 knot low level jet across eastern Arkansas moved into western Kentucky during the evening, resulting in isolated tornadoes and widespread damaging winds.",5
301816,CALLOWAY CO.,COPELAND,05/25/2011,1919,Tornado, ,EF0,0,0,10000,0,KY,CST-6, ,51005,C,35,PAH,0,0,NWS Storm Survey, ,0.27,80,1,W,0,WNW,COPELAND,05/25/2011,1920,36.7287,-88.4096,36.7317,-88.4063,"Several dozen mainly small trees were broken or uprooted. Most of the trees were small. The average path width was 50 yards. Peak winds were estimated near 70 mph.","Numerous strong to severe thunderstorms occurred in the warm sector of a low pressure system over central Missouri. The air mass in the warm sector was very unstable, with afternoon mixed-layer cape values in the 2500 to 4000 j/kg range. A 65 to 75 knot mid level jet was located across Arkansas, with the nose of the jet moving into western Kentucky. This feature enhanced the lift and strong deep-layer shear already in place, creating an environment very favorable for supercells and tornadoes. A 40 to 55 knot low level jet across eastern Arkansas moved into western Kentucky during the evening, resulting in isolated tornadoes and widespread damaging winds.",6
302364,DAVIESS CO.,DELAWARE,05/25/2011,1932,Funnel Cloud, , ,0,0,0,0,KY,CST-6, ,51005,C,59,PAH,0,0,Trained Spotter, , , ,0,N,0,N,DELAWARE,05/25/2011,1932,37.68,-87.4,37.68,-87.4,"","Numerous strong to severe thunderstorms occurred in the warm sector of a low pressure system over central Missouri. The air mass in the warm sector was very unstable, with afternoon mixed-layer cape values in the 2500 to 4000 j/kg range. A 65 to 75 knot mid level jet was located across Arkansas, with the nose of the jet moving into western Kentucky. This feature enhanced the lift and strong deep-layer shear already in place, creating an environment very favorable for supercells and tornadoes. A 40 to 55 knot low level jet across eastern Arkansas moved into western Kentucky during the evening, resulting in isolated tornadoes and widespread damaging winds.",7
301806,HOPKINS CO.,DAWSON SPGS,05/25/2011,1942,Funnel Cloud, , ,0,0,0,0,KY,CST-6, ,51005,C,107,PAH,0,0,Trained Spotter, , , ,2,N,2,N,DAWSON SPGS,05/25/2011,1942,37.199,-87.7,37.199,-87.7,"","Numerous strong to severe thunderstorms occurred in the warm sector of a low pressure system over central Missouri. The air mass in the warm sector was very unstable, with afternoon mixed-layer cape values in the 2500 to 4000 j/kg range. A 65 to 75 knot mid level jet was located across Arkansas, with the nose of the jet moving into western Kentucky. This feature enhanced the lift and strong deep-layer shear already in place, creating an environment very favorable for supercells and tornadoes. A 40 to 55 knot low level jet across eastern Arkansas moved into western Kentucky during the evening, resulting in isolated tornadoes and widespread damaging winds.",8
302365,DAVIESS CO.,OWENSBORO,05/25/2011,1955,Funnel Cloud, , ,0,0,0,0,KY,CST-6, ,51005,C,59,PAH,0,0,Trained Spotter, , , ,0,N,0,N,OWENSBORO,05/25/2011,1955,37.77,-87.12,37.77,-87.12,"","Numerous strong to severe thunderstorms occurred in the warm sector of a low pressure system over central Missouri. The air mass in the warm sector was very unstable, with afternoon mixed-layer cape values in the 2500 to 4000 j/kg range. A 65 to 75 knot mid level jet was located across Arkansas, with the nose of the jet moving into western Kentucky. This feature enhanced the lift and strong deep-layer shear already in place, creating an environment very favorable for supercells and tornadoes. A 40 to 55 knot low level jet across eastern Arkansas moved into western Kentucky during the evening, resulting in isolated tornadoes and widespread damaging winds.",9
301807,TRIGG CO.,LINTON,05/25/2011,2009,Funnel Cloud, , ,0,0,0,0,KY,CST-6, ,51005,C,221,PAH,0,0,Trained Spotter, , , ,3,NE,3,NE,LINTON,05/25/2011,2009,36.7037,-87.8632,36.7037,-87.8632,"There were several reports of funnel clouds in the southwest part of the county.","Numerous strong to severe thunderstorms occurred in the warm sector of a low pressure system over central Missouri. The air mass in the warm sector was very unstable, with afternoon mixed-layer cape values in the 2500 to 4000 j/kg range. A 65 to 75 knot mid level jet was located across Arkansas, with the nose of the jet moving into western Kentucky. This feature enhanced the lift and strong deep-layer shear already in place, creating an environment very favorable for supercells and tornadoes. A 40 to 55 knot low level jet across eastern Arkansas moved into western Kentucky during the evening, resulting in isolated tornadoes and widespread damaging winds.",10
301819,CALLOWAY CO.,NEW CONCORD,05/25/2011,2017,Tornado, ,EF0,0,0,50000,0,KY,CST-6, ,51005,C,35,PAH,0,0,NWS Storm Survey, ,0.39,50,3,N,3,NNE,NEW CONCORD,05/25/2011,2018,36.5903,-88.1422,36.5886,-88.1355,"About a dozen trees and several tree tops were snapped. One car was completely destroyed by a large fallen tree. Mostly minor damage occurred to a couple of homes or garages. At least one power line was downed. Peak wind speeds were estimated near 85 mph.","Numerous strong to severe thunderstorms occurred in the warm sector of a low pressure system over central Missouri. The air mass in the warm sector was very unstable, with afternoon mixed-layer cape values in the 2500 to 4000 j/kg range. A 65 to 75 knot mid level jet was located across Arkansas, with the nose of the jet moving into western Kentucky. This feature enhanced the lift and strong deep-layer shear already in place, creating an environment very favorable for supercells and tornadoes. A 40 to 55 knot low level jet across eastern Arkansas moved into western Kentucky during the evening, resulting in isolated tornadoes and widespread damaging winds.",11
303233,MUHLENBERG CO.,DRAKESBORO,05/25/2011,2045,Funnel Cloud, , ,0,0,0,0,KY,CST-6, ,51005,C,177,PAH,0,0,Fire Department/Rescue, , , ,0,N,0,N,DRAKESBORO,05/25/2011,2045,37.22,-87.05,37.22,-87.05,"","Numerous strong to severe thunderstorms occurred in the warm sector of a low pressure system over central Missouri. The air mass in the warm sector was very unstable, with afternoon mixed-layer cape values in the 2500 to 4000 j/kg range. A 65 to 75 knot mid level jet was located across Arkansas, with the nose of the jet moving into western Kentucky. This feature enhanced the lift and strong deep-layer shear already in place, creating an environment very favorable for supercells and tornadoes. A 40 to 55 knot low level jet across eastern Arkansas moved into western Kentucky during the evening, resulting in isolated tornadoes and widespread damaging winds.",12
313564,HENDERSON CO.,BASKETT,06/05/2011,955,Funnel Cloud, , ,0,0,0,0,KY,CST-6, ,52486,C,101,PAH,0,0,Public, , , ,2,ENE,2,ENE,BASKETT,06/05/2011,955,37.88,-87.44,37.88,-87.44,"The general public reported a funnel cloud along U.S. Highway 60 between Spottsville and the Daviess County line.","A mesoscale convective system that originated over the Mid-Mississippi Valley moved southeast across the Pennyrile region of western Kentucky. The system moved along the northern periphery of a 500 mb ridge that was centered over the Tennessee Valley and southern Plains.",13
308544,BRECKINRIDGE CO.,HARNED,06/19/2011,539,Tornado, ,EF2,0,0,50000,0,KY,CST-6, ,51801,C,27,LMK,0,0,NWS Storm Survey, ,1,60,0,S,1,ESE,HARNED,06/19/2011,542,37.7473,-86.4204,37.7467,-86.402,"The tornado first touched down at the west end of H Wilson Road as an EF-0, where around one dozen trees were snapped and uprooted.  A barn collapsed when an oak tree fell on it.  At the intersection of State Highway 79 and H Wilson Road, EF-2 damage occurred when a roof was torn from a home and thrown 60 yards.  A 30 by 50 foot barn was thrown 200 yards and metal sheeting was thrown 300 yards.  Several power poles were found leaning over State Highway 79.  This tornado dissipated after snapping and uprooting several trees between State Highway 79 and Harned Locust Hill Road.","A severe squall line moved east along the Ohio River west of Louisville during the early morning hours on June 19th. Along with widespread damaging winds, several tornadoes developed along the leading edge of the gust front across southern Indiana and Central Kentucky.",14
308545,BRECKINRIDGE CO.,LOCUST HILL,06/19/2011,543,Tornado, ,EF0,0,0,5000,0,KY,CST-6, ,51801,C,27,LMK,0,0,NWS Storm Survey, ,0.1,60,1,NW,1,NW,LOCUST HILL,06/19/2011,544,37.7413,-86.3876,37.7414,-86.3849,"This weak EF-0 Tornado was only briefly on the ground.  Along Route 1401, winds estimated at 80 mph tore roof panels off of a large well constructed barn and threw them 200 yards.","A severe squall line moved east along the Ohio River west of Louisville during the early morning hours on June 19th. Along with widespread damaging winds, several tornadoes developed along the leading edge of the gust front across southern Indiana and Central Kentucky.",15
308156,JEFFERSON CO.,LOUISVILLE,06/22/2011,1904,Tornado, ,EF2,0,0,400000,0,KY,EST-5, ,51756,C,111,LMK,0,0,NWS Storm Survey, ,1.2,120,2,S,1,WNW,AUDUBON PARK,06/22/2011,1907,38.1986,-85.7726,38.2045,-85.7515,"This tornado touched down just southwest of an area of horse barns on the south side of Churchill Downs. Five barns, which also contained apartments for many workers, had major sections of their roofs removed, with minor damage to several others. In the buildings most heavily damaged, parts of supporting walls made from cinder blocks collapsed.  Christ Church, located on the Churchill Downs property, also had roof and siding damage. After snapping trees and downing power lines for several blocks to the east of Churchill, the tornado crossed a large stadium parking lot, strengthening to low-end EF-2 intensity near the intersection of Floyd Street and Central Avenue. At this location, just 300 yards southeast of the University of Louisville's football stadium, a large industrial building was heavily damaged, with a collapsed 2-story cinder block wall and a 150-foot section of roof removed from the warehouse.  A 30' x 80' section of roof over an adjacent office building was also torn off.   The tornado downed several more trees and did minor roof damage to a Super 8 Motel and other office buildings before lifting north of the intersection of Crittenden Drive and Central Avenue near an entrance ramp onto Interstate 65. ||Despite the most heavily damaged Churchill Downs buildings being occupied by numerous racing horses and at least three workers at the time of the tornado, no injuries were sustained by either the animals or their handlers.  One man was in an upstairs room when the roof above him was ripped off, while two others were in in a ground-floor apartment where cinder blocks fell from an exterior wall.","A deep occluded closed low across the Upper Midwest brought a cold front and wind shift along the Ohio River during the early evening hours on June 22nd. Scattered storms developed to the west of Louisville during the late afternoon and intensified as they moved east into Jefferson County, Kentucky. Although instability was marginal, a jet streak aloft combined with directional wind shear closer the the surface allowed several low topped supercells to develop just to the west of Louisville. The first storm generated a tornado that damaged several horse barns at Churchill Downs and destroyed a large industrial building just southeast of the University of Louisville's football stadium.  A second rotating supercell tracked just to the south of the first storm, spawning three brief tornadoes along a west to east path in the eastern part of the Louisville Metro area.",16
308161,JEFFERSON CO.,STRATHMOOR MANOR,06/22/2011,2029,Tornado, ,EF1,0,0,150000,0,KY,EST-5, ,51756,C,111,LMK,0,0,NWS Storm Survey, ,1.9,150,1,S,1,SW,JEFFERSONTOWN,06/22/2011,2033,38.1906,-85.6192,38.1936,-85.581,"This tornado was the first of three separate touchdowns associated with a single supercell that tracked across the southern portion of Jefferson County.  Initially, this tornado touched down at EF-0 strength near the intersection of Nachand Lane and Nachand Spring Lane where minor shingle damage and snapped trees were surveyed. After moving into the Hurstbourne Woods subdivision, the twister damaged a locked pool gate and blew it 35 yards downwind. This subdivision sustained EF-1 damage with gutters, soffits, and siding from various structures deposited in trees. At 9407 Willowwood Way, roof damage was noted, along with many uprooted hardwood and softwood trees. After making a brief 25 degree northward turn near the end of its life, the tornado brought minor roof damage before lifting near the intersection of Lisa Lane and Calais Drive.","A deep occluded closed low across the Upper Midwest brought a cold front and wind shift along the Ohio River during the early evening hours on June 22nd. Scattered storms developed to the west of Louisville during the late afternoon and intensified as they moved east into Jefferson County, Kentucky. Although instability was marginal, a jet streak aloft combined with directional wind shear closer the the surface allowed several low topped supercells to develop just to the west of Louisville. The first storm generated a tornado that damaged several horse barns at Churchill Downs and destroyed a large industrial building just southeast of the University of Louisville's football stadium.  A second rotating supercell tracked just to the south of the first storm, spawning three brief tornadoes along a west to east path in the eastern part of the Louisville Metro area.",17
308169,JEFFERSON CO.,JEFFERSONTOWN,06/22/2011,2034,Tornado, ,EF2,0,0,175000,0,KY,EST-5, ,51756,C,111,LMK,0,0,NWS Storm Survey, ,1.6,100,1,SW,1,W,TUCKER STATION,06/22/2011,2037,38.1949,-85.5778,38.2016,-85.5492,"The public reported a second tornado touchdown near the same time and location where the first one ended.  After touching down just east of Saint Edward Catholic Church on Sue Helen Drive, this tornado uprooted trees and damaged the roofs of around one dozen homes along Saint Edwards Drive.  Damage also was surveyed along Charlane Parkway and Dell Road. At the corner of Maple Road and Galene Drive, a large section of an oak tree split and was driven into a wall at Tully School.  Low end EF-2 structural and roof damage was also noted at at the Good Samaritan Society Nursing Home.   Two vehicles in a parking lot were flipped and moved 25 feet. After briefly lifting, this tornado then damaged both Dillard's and Machinery Specialty's warehouses along Electron Drive.  The brick facades of both building were pushed out.  After throwing a small shed 30 yards near the Dillard's Warehouse, the twister lifted just near the intersection of Electron Drive and Ampere Drive.","A deep occluded closed low across the Upper Midwest brought a cold front and wind shift along the Ohio River during the early evening hours on June 22nd. Scattered storms developed to the west of Louisville during the late afternoon and intensified as they moved east into Jefferson County, Kentucky. Although instability was marginal, a jet streak aloft combined with directional wind shear closer the the surface allowed several low topped supercells to develop just to the west of Louisville. The first storm generated a tornado that damaged several horse barns at Churchill Downs and destroyed a large industrial building just southeast of the University of Louisville's football stadium.  A second rotating supercell tracked just to the south of the first storm, spawning three brief tornadoes along a west to east path in the eastern part of the Louisville Metro area.",18
308173,JEFFERSON CO.,TUCKER STATION,06/22/2011,2038,Tornado, ,EF1,0,0,75000,0,KY,EST-5, ,51756,C,111,LMK,0,0,NWS Storm Survey, ,3.5,60,1,W,2,WSW,EASTWOOD,06/22/2011,2045,38.2025,-85.5488,38.2162,-85.4847,"The last in a series of tornadoes spawned by the same storm touched down near the intersection of Electron and Ampere Drives, near the same location that the second twister lifted.  This tornado was intermittently on the ground for 3.5 miles, crossing Interstate 265 and lifting just east of 1600 South English Station Road.  Near the touchdown point, an air-conditioning unit was blown off the roof of JCK Enterprises. Several corporate buildings and warehouses on Electron Drive had roof and siding damage.  EF-1 damage to some steel framing and stucco was noted at the Oxmoor Collision Center and the RBI Corporation.  More than one dozen trees were uprooted around the Tucker House Bed and Breakfast on Tucker Station Road.  The public reported a rope like tornado lifting just west of Interstate 265 and touching down again near 1600 South English Station Road.  EF-0 damage was noted to several trees and a satellite dish at this location.","A deep occluded closed low across the Upper Midwest brought a cold front and wind shift along the Ohio River during the early evening hours on June 22nd. Scattered storms developed to the west of Louisville during the late afternoon and intensified as they moved east into Jefferson County, Kentucky. Although instability was marginal, a jet streak aloft combined with directional wind shear closer the the surface allowed several low topped supercells to develop just to the west of Louisville. The first storm generated a tornado that damaged several horse barns at Churchill Downs and destroyed a large industrial building just southeast of the University of Louisville's football stadium.  A second rotating supercell tracked just to the south of the first storm, spawning three brief tornadoes along a west to east path in the eastern part of the Louisville Metro area.",19
342875,HOPKINS CO.,WHITE PLAINS,09/25/2011,1925,Tornado, ,EF2,0,0,80000,0,KY,CST-6, ,57218,C,107,PAH,0,0,NWS Storm Survey, ,0.52,80,1,SSW,0,ESE,WHITE PLAINS,09/25/2011,1926,37.1725,-87.3822,37.1778,-87.3755,"This short-lived tornado occurred along Highway 813. One framed home and one mobile home were destroyed. There was minor damage to two framed homes. Four sheds were destroyed. Power lines were blown down. Several large trees were downed or uprooted. The destroyed mobile home was thrown about 30 feet into a tree. The lone resident of the mobile home was ejected, but he sustained no injuries requiring treatment. The destroyed framed home lost most of the roof, and bricks were shifted. Peak winds were estimated near 120 mph.","A surface low pressure center moved northeast from eastern Arkansas, passing across northwest Tennessee and into western Kentucky. A closed 500 mb low was centered over the Mid-Mississippi Valley. Along and east of the surface low pressure center track, scattered strong to severe thunderstorms were embedded within a large area of rain. The storms were aided by convergence in the exit region of an intense south-southwesterly low-level jet of around 50 knots. Upper-level divergence within the right entrance region of a jet streak over northern Indiana further enhanced the storms. A couple of isolated tornadoes and microbursts accompanied the storms.",20
342871,CHRISTIAN CO.,HERNDON,09/25/2011,1950,Tornado, ,EF1,0,0,40000,0,KY,CST-6, ,57218,C,47,PAH,0,0,NWS Storm Survey, ,1,100,2,NE,3,NE,HERNDON,09/25/2011,1951,36.7505,-87.5445,36.7607,-87.5317,"Two barns were damaged. One of the barns was nearly levelled. A pole barn lost one side and some roofing. Several trees were snapped or blown down, and several tree tops were snapped. Peak winds were estimated near 90 mph.","A surface low pressure center moved northeast from eastern Arkansas, passing across northwest Tennessee and into western Kentucky. A closed 500 mb low was centered over the Mid-Mississippi Valley. Along and east of the surface low pressure center track, scattered strong to severe thunderstorms were embedded within a large area of rain. The storms were aided by convergence in the exit region of an intense south-southwesterly low-level jet of around 50 knots. Upper-level divergence within the right entrance region of a jet streak over northern Indiana further enhanced the storms. A couple of isolated tornadoes and microbursts accompanied the storms.",21
