EVENT_ID,CZ_NAME_STR,BEGIN_LOCATION,BEGIN_DATE,BEGIN_TIME,EVENT_TYPE,MAGNITUDE,TOR_F_SCALE,DEATHS_DIRECT,INJURIES_DIRECT,DAMAGE_PROPERTY_NUM,DAMAGE_CROPS_NUM,STATE_ABBR,CZ_TIMEZONE,MAGNITUDE_TYPE,EPISODE_ID,CZ_TYPE,CZ_FIPS,WFO,INJURIES_INDIRECT,DEATHS_INDIRECT,SOURCE,FLOOD_CAUSE,TOR_LENGTH,TOR_WIDTH,BEGIN_RANGE,BEGIN_AZIMUTH,END_RANGE,END_AZIMUTH,END_LOCATION,END_DATE,END_TIME,BEGIN_LAT,BEGIN_LON,END_LAT,END_LON,EVENT_NARRATIVE,EPISODE_NARRATIVE,ABSOLUTE_ROWNUMBER
569578,EDMONSON CO.,HUFF,04/25/2015,2012,Tornado, ,EF2,0,0,0,0,KY,CST-6, ,93821,C,61,LMK,0,0,NWS Storm Survey, ,0.17,220,1,E,1,E,HUFF,04/25/2015,2014,37.2499,-86.35,37.2512,-86.3474,"A narrow tornado developed quickly just west of 3667 Grassland Black Gold Rd (Highway 1365) and snapped a few softwood and few wood large limbs. It then grew in width and intensity as it crossed Highway 1365 and uprooted, snapped and twisted over 200 trees in a heavily forested area around a deep karst ravine. A drone was used to pinpoint the exact storm end point which was about 100 yards east of Highway 1365 near a farmer's field.","An area of low pressure approached the Ohio Valley from the northwest on April 25th.  Ahead of it, a strong warm front sharpened across southern Indiana and central Kentucky.  South of the front, sunshine broke out and helped temperatures surge into the 80s, while north of the front temperatures were only in the 50s. At one point, there was a 40 degree temperature difference across the state of Kentucky from north to south!  This strong front helped to focus severe thunderstorm development in the late afternoon and evening hours.  Many of the storms that formed were supercells, which dropped very large hail. Two of these supercells developed weak tornadoes during the evening hours.",205
571140,CHRISTIAN CO.,OAK GROVE,05/16/2015,1620,Funnel Cloud, , ,0,0,0,0,KY,CST-6, ,94973,C,47,PAH,0,0,Trained Spotter, , , ,2,NE,2,NE,OAK GROVE,05/16/2015,1620,36.6905,-87.4045,36.6905,-87.4045,"A funnel cloud was videotaped over open farmland in the vicinity of Oak Grove, near exit 86 of Interstate 24.","High pressure along the southeast U.S. coast produced a very moist south wind flow. At upper levels, a 500 mb shortwave moved north ahead of a closed low over the western states. This shortwave interacted with the moist southerly wind flow to produce areas of heavy rain. One of the storms acquired rotation and produced a short-lived funnel cloud.",206
578658,GRAVES CO.,FARMINGTON,06/19/2015,1230,Tornado, ,EF0,0,0,4000,5000,KY,CST-6, ,96253,C,83,PAH,0,0,NWS Storm Survey, ,1.79,150,0,N,2,NE,FARMINGTON,06/19/2015,1236,36.6765,-88.519,36.6947,-88.4961,"Several trees and tree limbs were blown down. Swaths of corn and wheat were blown down in farm fields. The tornado began along Kentucky Highway 80 near Farmington, then moved northeast across Highway 564. Peak winds were estimated by a damage survey team near 75 mph. The average path width was about 75 yards.","Rain bands associated with the remnants of Tropical Storm Bill produced isolated tornadoes and locally strong winds. The convective character of the bands increased during the afternoon due to short intervals of sunshine that destabilized the atmosphere. The surface low pressure center that constituted the remnants of Bill was located over the extreme southeast corner of Missouri during the afternoon. Rain bands rotated northward across western Kentucky ahead of the low pressure center.",207
583519,PULASKI CO.,BURNETTA,07/01/2015,1500,Tornado, ,EF0,0,0,0,0,KY,EST-5, ,97028,C,199,JKL,0,0,NWS Storm Survey, ,0.3,100,1,WSW,1,SW,BURNETTA,07/01/2015,1501,37.06,-84.8,37.0614,-84.7921,"A weather service storm survey confirmed that an EF-0 tornado briefly touched down near Nancy, KY. The estimated maximum winds in the tornado were 75 mph. The path width of the tornado was approximately 100 yards, with a path length of 0.3 miles. The tornado was on the ground for less than a minute. Minor tree damage and structural damage were observed at the intersection of Hwy 1664 and Pierce Road. An old barn collapsed due to the storm and some shingles were blown off a home. A few tombstones in a nearby cemetery were overturned by the tornadoes winds. This tornado developed from a shower.  No thunder or lightning was ever observed in the area.","Heavy rain from thunderstorms lead to flash flooding across portions of Pulaski and Jackson counties during the late afternoon and evening hours of July 1, 2015. A brief, and quite unexpected, tornado touched down briefly in Pulaski county. A funnel cloud from the same storm/shower that produced the tornado was sighted in Whitley county later in the evening.",208
583513,WHITLEY CO.,FABER,07/01/2015,1720,Funnel Cloud, , ,0,0,0,0,KY,EST-5, ,97028,C,235,JKL,0,0,Broadcast Media, , , ,0,N,0,N,FABER,07/01/2015,1720,36.88,-84.13,36.88,-84.13,"A funnel cloud was observed passing over Faber.","Heavy rain from thunderstorms lead to flash flooding across portions of Pulaski and Jackson counties during the late afternoon and evening hours of July 1, 2015. A brief, and quite unexpected, tornado touched down briefly in Pulaski county. A funnel cloud from the same storm/shower that produced the tornado was sighted in Whitley county later in the evening.",209
586740,WEBSTER CO.,SEBREE,07/05/2015,1426,Tornado, ,EF0,0,0,0,0,KY,CST-6, ,97514,C,233,PAH,0,0,Trained Spotter, ,1,30,4,SSE,5,SSE,SEBREE,07/05/2015,1429,37.5465,-87.5021,37.5331,-87.4951,"A slow-moving funnel cloud was observed for about five minutes over open country. A trained spotter reported the funnel touched down as a tornado for a few minutes and stirred up some debris. No damage site was located by the spotter or reported by other sources. This tornado was associated with an isolated light rain shower. This type of tornado is commonly called a landspout. Landspouts occur when extremely buoyant air is lifted and rotates near the base of a rain shower of thunderstorm. Most landspouts do little damage.","An isolated rain shower produced a landspout over northwest Kentucky near Sebree. The rain shower was associated with a weak stationary front that extended eastward from the central Plains across the Lower Ohio Valley to the central Appalachians.",210
584082,FLEMING CO.,FLEMINGSBURG JCT,07/07/2015,1629,Tornado, ,EF0,0,0,0,0,KY,EST-5, ,97126,C,69,JKL,0,0,NWS Storm Survey, ,0.25,50,2,ENE,3,ENE,FLEMINGSBURG JCT,07/07/2015,1630,38.4619,-83.7588,38.4648,-83.756,"A tornado touched down briefly on a farm along Highway 11. A small farm building was destroyed and another had its windows blown out. A few trees were damaged and/or uprooted as well. The tornado touched down and the end of a 3 mile path of intermittent straight line wind damage. The tornado was EF0 with estimated winds of 80 mph.","Scattered thunderstorms erupted during the afternoon hours on July 7, 2015.  The strongest storms were able to produce a few instances of wind damage, and even a brief tornado touchdown north of Flemingsburg.",211
587036,MEADE CO.,COBURG,07/10/2015,935,Tornado, ,EF0,0,0,0,0,KY,EST-5, ,96072,C,163,LMK,0,0,NWS Storm Survey, ,3.24,100,61,NW,59,NW,COBURG,07/10/2015,938,37.8784,-86.0352,37.8792,-85.9759,"A NWS storm survey found evidence of a weak, skipping tornado that occurred on the base of Fort Knox in Meade and Hardin Counties in Kentucky.  The tornado first touched down near the intersection of Lee Road and Fort Avenue just west of the military base's boundary.  It traveled east over forested land, doing occasional damage to trees before it passed into Hardin County, 0.7 miles WSW of the U.S. Bullion Depository.","A moist and unstable air mass interacted with a stalled frontal boundary across central Kentucky and an approaching upper level disturbance to spark a round of severe thunderstorms during the late morning and afternoon hours July 10th. Damaging winds brought down trees and power lines resulting in some structural damage across the area. A couple of short lived tornadoes were also found to have occurred near Fort Knox and Belmont, Kentucky.",212
597074,HARDIN CO.,PRICHARD PLACE,07/10/2015,938,Tornado, ,EF0,0,0,25000,0,KY,EST-5, ,96072,C,93,LMK,0,0,NWS Storm Survey, ,2.51,100,0,WSW,2,ENE,PRICHARD PLACE,07/10/2015,941,37.8787,-85.9758,37.89,-85.932,"This is the continuation of the weak, skipping tornado that began just west of the boundary of Ft. Knox in Meade County, KY.  This tornado passed into Hardin County 0.7 miles WSW of the U.S. Gold Depository on Ft. Knox, traveled east for approximately 0.5 miles, then turned northeast over the PX and commissary complex before lifting 0.6 miles ENE of the base High School near Wilson Rd.  Several large Hackberry and Oak trees were uprooted and snapped between the PX and Scott Middle School. There was also some shingle damage to some of the buildings near the high school track. The tornado also caused significant tree damage from the middle school north/northeast across a remote area of the northeast part of the post.","A moist and unstable air mass interacted with a stalled frontal boundary across central Kentucky and an approaching upper level disturbance to spark a round of severe thunderstorms during the late morning and afternoon hours July 10th. Damaging winds brought down trees and power lines resulting in some structural damage across the area. A couple of short lived tornadoes were also found to have occurred near Fort Knox and Belmont, Kentucky.",213
587037,BULLITT CO.,BELMONT,07/10/2015,953,Tornado, ,EF0,0,0,75000,0,KY,EST-5, ,96072,C,29,LMK,0,0,NWS Storm Survey, ,0.9,150,1,NNW,1,NNE,BELMONT,07/10/2015,954,37.8942,-85.7279,37.8963,-85.7122,"A NWS survey, conducted with Bullitt County Emergency management, confirmed a small EF-0 tornado touched down in southern Bullitt County, just east of the eastern boundary of Fort Knox Army Base. This rain-wrapped tornado was only on the ground for about minute, with most of its damage limited to large limbs and weaker tree trunks being snapped.  The tornado started along Belmont Rd (KY Highway 251) 0.7 miles west of Belmont, then traveled east-northeast through the community of Belmont, and lifting just east of Church Street. At least three homes were damaged, two from trees falling on them, with minor roofing damage to a third.  Trees also fell on at least two out buildings. The storm that spawned this tornado was the same one that produced an EF-0 moments earlier 11 miles to the west.","A moist and unstable air mass interacted with a stalled frontal boundary across central Kentucky and an approaching upper level disturbance to spark a round of severe thunderstorms during the late morning and afternoon hours July 10th. Damaging winds brought down trees and power lines resulting in some structural damage across the area. A couple of short lived tornadoes were also found to have occurred near Fort Knox and Belmont, Kentucky.",214
587027,GREEN CO.,GRESHAM,07/13/2015,1620,Tornado, ,EF1,0,0,200000,0,KY,CST-6, ,96638,C,87,LMK,0,0,Public, ,1.1,50,1,NE,0,WNW,GRESHAM,07/13/2015,1622,37.2091,-85.4418,37.2026,-85.4562,"This brief tornado tracked for approximately 1.1 miles with a maximum width of 50 yards. The highest winds were estimated to have been 95 to 105 mph. The tornado destroyed two barns and one mobile home in addition to considerable roof damage to six outbuildings along Ebenezer Road and Highway 61 southeast of Greensburg.","A series of upper level disturbances moved from the Upper Midwest into the lower Ohio Valley and interacted with a moist, warm and unstable atmosphere. Strong to severe thunderstorms developed and then organized into bowing segments across the area, spawning three weak tornadoes in addition to widespread areas of downburst wind damage. Thousands of trees were downed, causing scattered power outages and some structural damage.  In addition, due to the very wet antecedent conditions, flash flooding occurred in several locations, resulting in closed and impassable roads, water rescues and significant property damage. The most widespread and hardest hit areas were along and east of Interstate 65 in central Kentucky. Rainfall amounts over the period were in excess of 5 to 7 inches. Several rivers across the region went above flood stage, cresting several feet above flood stage.",215
587029,ADAIR CO.,BREEDING,07/13/2015,1658,Tornado, ,EF0,0,0,1000,0,KY,CST-6, ,96638,C,1,LMK,0,0,NWS Storm Survey, ,1.5,35,1,N,1,SSE,BREEDING,07/13/2015,1700,36.963,-85.42,36.9406,-85.4152,"This small tornado destroyed one outbuilding in addition to uprooting and snapping limbs on several trees in a very narrow path near the community of Breeding in southwest Adair County.","A series of upper level disturbances moved from the Upper Midwest into the lower Ohio Valley and interacted with a moist, warm and unstable atmosphere. Strong to severe thunderstorms developed and then organized into bowing segments across the area, spawning three weak tornadoes in addition to widespread areas of downburst wind damage. Thousands of trees were downed, causing scattered power outages and some structural damage.  In addition, due to the very wet antecedent conditions, flash flooding occurred in several locations, resulting in closed and impassable roads, water rescues and significant property damage. The most widespread and hardest hit areas were along and east of Interstate 65 in central Kentucky. Rainfall amounts over the period were in excess of 5 to 7 inches. Several rivers across the region went above flood stage, cresting several feet above flood stage.",216
587028,CUMBERLAND CO.,ASHLOCK,07/13/2015,1713,Tornado, ,EF0,0,0,50000,0,KY,CST-6, ,96638,C,57,LMK,0,0,Public, ,0.7,100,1,NW,0,SW,ASHLOCK,07/13/2015,1715,36.6276,-85.4374,36.6189,-85.4312,"This small tornado destoryed one outbuilding and tore roof panels off another before crossing the state line into the Pearidge area of Tennessee just west of Dale Hollow Lake.","A series of upper level disturbances moved from the Upper Midwest into the lower Ohio Valley and interacted with a moist, warm and unstable atmosphere. Strong to severe thunderstorms developed and then organized into bowing segments across the area, spawning three weak tornadoes in addition to widespread areas of downburst wind damage. Thousands of trees were downed, causing scattered power outages and some structural damage.  In addition, due to the very wet antecedent conditions, flash flooding occurred in several locations, resulting in closed and impassable roads, water rescues and significant property damage. The most widespread and hardest hit areas were along and east of Interstate 65 in central Kentucky. Rainfall amounts over the period were in excess of 5 to 7 inches. Several rivers across the region went above flood stage, cresting several feet above flood stage.",217
584493,FLEMING CO.,DALESBURG,07/14/2015,1638,Tornado, ,EF1,0,0,50000,0,KY,EST-5, ,97191,C,69,JKL,0,0,NWS Storm Survey, ,0.5,200,2,WSW,1,WSW,DALESBURG,07/14/2015,1639,38.458,-83.6965,38.4618,-83.6887,"An EF1 tornado with 100 mph winds touched down on a farm off Harn Road around 3 miles northeast of Flemingsburg. The tornado damaged or destroyed barns and shoved a mobile home several feet off its foundation while ripping the roof off of the structure. The tornado touched down within a 6.5 mile swath of 80-100 mph straight line winds.","The second of three rounds of severe weather arrived shortly after midnight on July 14th as a complex of thunderstorms barreled southeastward into east Kentucky.  This complex of storms produced sporadic wind damage and some flash flooding through the morning hours, hitting the Upper Cumberland region of south central and southeast Kentucky the hardest.  ||Round three arrived as a line of strong to severe storms dropped southward across the region during the late afternoon and evening hours of the 14th.  Once again, wind damage was widespread and numerous locations experienced flash flooding due to torrential rainfall rates and already saturated ground. ||A 6.5 mile long swath of concentrated wind damage occurred north of Flemingsburg during the late afternoon of the 14th.  This demolished a mobile home and injured four people as winds reached 100 mph.  An EF1 tornado touched down briefly inside this larger path of damaging straight-line winds. ||All in all, there were around 200 different severe weather (flash flood, wind damage, hail greater than 1 in diameter, and/or tornado) reports called into the National Weather Service office in Jackson, KY for the 36 hour period ending midnight Tuesday night.  At one point, over 50,000 east Kentucky households were without power due to the storms with many remaining without power through Friday July 17th.",218
609725,GRAVES CO.,SYMSONIA,12/23/2015,1518,Funnel Cloud, , ,0,0,0,0,KY,CST-6, ,101869,C,83,PAH,0,0,Law Enforcement, , , ,1,NE,1,NE,SYMSONIA,12/23/2015,1518,36.9329,-88.5072,36.9329,-88.5072,"A funnel cloud was reported by state police along the Marshall and McCracken County line.","Two fast-moving lines of strong to severe storms moved east across western Kentucky, accompanied by strong winds, isolated large hail, and torrential rainfall. A few bowing segments along the lines produced damaging winds. Conditions were favorable for severe storms. A negatively-tilted mid-level trough from the central high Plains to the Arklatex ejected northeast through the middle Mississippi Valley. At the surface, an area of low pressure over northeast Kansas moved to central Wisconsin. A trailing cold front surged eastward through the Mid-Mississippi and Lower Ohio Valleys. The storms were fed by a broadening and strengthening southwesterly low-level jet, which moistened and destabilized the atmosphere ahead of the storms. Some places received about 1.5 inches of rain within 45 minutes. The presence of strong winds aloft enhanced the risk of wind damage.",219
609726,DAVIESS CO.,WEST LOUISVILLE,12/23/2015,1530,Funnel Cloud, , ,0,0,0,0,KY,CST-6, ,101869,C,59,PAH,0,0,Trained Spotter, , , ,1,S,1,S,WEST LOUISVILLE,12/23/2015,1530,37.6825,-87.2827,37.6825,-87.2827,"A funnel cloud was reported by a trained spotter.","Two fast-moving lines of strong to severe storms moved east across western Kentucky, accompanied by strong winds, isolated large hail, and torrential rainfall. A few bowing segments along the lines produced damaging winds. Conditions were favorable for severe storms. A negatively-tilted mid-level trough from the central high Plains to the Arklatex ejected northeast through the middle Mississippi Valley. At the surface, an area of low pressure over northeast Kansas moved to central Wisconsin. A trailing cold front surged eastward through the Mid-Mississippi and Lower Ohio Valleys. The storms were fed by a broadening and strengthening southwesterly low-level jet, which moistened and destabilized the atmosphere ahead of the storms. Some places received about 1.5 inches of rain within 45 minutes. The presence of strong winds aloft enhanced the risk of wind damage.",220
606280,PENDLETON CO.,GREENWOOD,12/23/2015,2011,Tornado, ,EF1,0,3,120000,0,KY,EST-5, ,101340,C,191,ILN,0,0,NWS Storm Survey, ,3.75,420,2,SSE,2,NNW,PENHURST,12/23/2015,2016,38.7167,-84.371,38.752,-84.2787,"Damage was first observed just north of the intersection of U.S. Route 27 and Bethel Loop. This location is south of Butler and northwest of Falmouth in Pendleton County. A mobile home originally anchored into the ground at 8-10 points was tilted and briefly lifted before rolling onto its top on the east side of Bethel Loop. The three residents sustained minor injuries requiring overnight hospitalization. Debris from the mobile home was carried downwind for approximately one-tenth of a mile. The debris field remained confined to a narrow path as it tapered to the east-northeast. This seemed indicative of convergent motion associated with the circulation. There were also several 6-8 inch trees snapped immediately west of the mobile home. This is likely where the first touchdown occurred. The tornado then lifted. The next damage location was a metal barn on Ashcraft Road. The entire roof was lifted and removed from the barn. The roof measured approximately 60 feet by 30 feet and the barn was relatively new (construction within the last 10 years). The roof was carried into adjacent trees immediately northeast of the structure. There was minor damage to a smaller barn just northwest of the path center line. The homeowner also described a dock approximately 15 square feet that was pulled from its anchor and moved north-northeast across a pond toward the center line of the path. All of this damage indicated a convergent and lifting motion associated with the tornado. The tornado then lifted again, as damage was next observed along Route 609 just south of the intersection with Davis Road. One barn west of Route 609 was destroyed and a tree approximately 20 inches in diameter immediately east of the road was snapped at the trunk and fell against a residence. Debris was carried between one and two tenths of a mile to the northeast. Another barn just to the north was partially destroyed. Tornadic damage was not as conclusive at this location, but debris was confined to a narrow path likely due to convergent wind motion. A number of trees were snapped to the northeast along Davis Road. Trees ranged in diameter from 8 to 16 inches. The clearest evidence of circulation on the ground was located along Route 159 where several types of damage occurred at a residence south of the intersection with Davis Road. The roof was partially removed from the residence and some of the insulation was dispersed to the west and spattered against the west side of the house. Insulation was also spattered on trees immediately to the northwest. Heavy sections of metal fencing from a horse corral were lifted and carried approximately 50 yards to the west. Both of these debris fields were carried and deposited opposite the storm motion. A number of trees just north and south of the residence were also snapped. The tornado lifted again before touching down one last time. The final damage was found along Hickory Grove Road, south of the intersection with Route 10. This is the estimated end of the tornado path. A camper was lifted to the north-northeast approximately 10-15 feet over trees before being dropped and destroyed. There was also minor structural damage at two nearby mobile homes. This damage consisted of garage doors blown inward and some roof damage.","A squall line developed ahead of an ejecting upper system over the lower Ohio Valley and raced northeast into the region. A second squall line developed and trailed the first one by an hour or so.",221
618525,CALLOWAY CO.,MIDWAY,03/12/2016,2122,Tornado, ,EF0,0,0,30000,0,KY,CST-6, ,103491,C,35,PAH,0,0,NWS Storm Survey, ,0.32,50,0,WNW,0,NNW,MIDWAY,03/12/2016,2123,36.551,-88.3257,36.5544,-88.3219,"A National Weather Service damage survey revealed a brief EF-0 tornado struck the west side of the community of Midway. The tornado occurred along Highway 1828 and traveled about one-quarter mile northeast across U.S. Highway 641. On Highway 1828, approximately half of the roof was ripped off a single family residence, including the decking and some rafters. Small tree limbs were broken, and the underpinning was blown from a mobile home. Power lines were brought down. Peak winds were estimated near 85 mph.","A very short-lived, weak tornado touched down along U.S. Highway 641 between Murray and Hazel. The tornado formed within a line of thunderstorms (or quasi-linear convective system) that extended from north to south across western Kentucky. The storms moved through a marginally unstable air mass just south of a stationary front that was draped across the Lower Ohio Valley.",222
618767,CHRISTIAN CO.,HAWKINS,03/27/2016,1800,Tornado, ,EF2,0,0,1000000,0,KY,CST-6, ,103522,C,47,PAH,0,0,NWS Storm Survey, ,15.46,200,3,S,4,E,CROFTON,03/27/2016,1821,36.9801,-87.6681,37.05,-87.402,"This EF-2 tornado touched down just east of the Trigg County line, then moved east-northeast across Highway 91. The tornado continued east-northeast across the Pennyrile Parkway just south of Crofton. The average path width was 100 yards. The tornado path was through farmland interspersed with woodlands. Sixteen barns were destroyed. Ten other barns sustained minor to moderate damage. Two homes sustained moderate damage. Ten tractors or farm implements were damaged. One farmer near Crofton estimated damage was near one-half million dollars just at his farm alone. Nearly 500 utility customers were without power after the tornado. The highest estimated wind speeds of 115 mph were at a farm on Highway 91, where a two-ton truck was overturned.","Thunderstorms increased in coverage and intensity during the afternoon hours ahead of an advancing cold front over southern Illinois and southeast Missouri. Large hail accompanied a couple of the storms due to unseasonably cold air aloft. Wind profiles aloft favored cellular activity, including a couple of supercells that spawned tornadoes.",223
618768,CHRISTIAN CO.,CROFTON,03/27/2016,1811,Tornado, ,EF0,0,0,6000,0,KY,CST-6, ,103522,C,47,PAH,0,0,NWS Storm Survey, ,3.4,100,5,W,2,W,CROFTON,03/27/2016,1817,37.05,-87.5779,37.05,-87.5163,"Minor roof damage occurred on two homes. A few trees were uprooted or snapped. Large tree limbs were down. The average path width was 75 yards. Peak winds were estimated near 80 mph. Much of the path was along or near Highway 800 west of Crofton.","Thunderstorms increased in coverage and intensity during the afternoon hours ahead of an advancing cold front over southern Illinois and southeast Missouri. Large hail accompanied a couple of the storms due to unseasonably cold air aloft. Wind profiles aloft favored cellular activity, including a couple of supercells that spawned tornadoes.",224
